{
  "spec_version": "1.6.0",
  "since": "1.0.0",
  "name": "utility/bounded-deferral-cap",
  "description": "The bound caps t*.",
  "policy": {
    "specVersion": "1.0.0",
    "checks": [
      {
        "id": "consent"
      },
      {
        "id": "boundedDeferral",
        "lambda": 1,
        "interruptCost": 1,
        "staleness": 0.0001,
        "boundSeconds": 240
      }
    ]
  },
  "tests": [
    {
      "description": "t* would be 5000 s; capped at 240",
      "input": {
        "user": {
          "id": "u1",
          "consent": true,
          "proactiveEnabled": true,
          "mode": "normal",
          "intensity": "normal",
          "timezone": "Europe/Istanbul",
          "quietHours": {
            "start": "22:00",
            "end": "08:00"
          },
          "createdAt": "2026-01-01T00:00:00Z"
        },
        "candidate": {
          "id": "c1",
          "type": "reminder",
          "priority": "normal",
          "surfaces": [
            "push",
            "feed"
          ],
          "busy": true
        },
        "now": "2026-09-04T09:00:00Z"
      },
      "expect": {
        "allowed": true,
        "deliverAt": "2026-09-04T09:04:00.000Z",
        "trace": [
          "consent",
          "boundedDeferral"
        ]
      }
    }
  ]
}
